1215	factoid	When was President Kennedy shot? 	1963
1216	factoid	What is TMJ? 	Temporomandibular Joint|disk that connects|irritation|jaw joint|lower jaw
1218	factoid	What date was Dwight D. Eisenhower born? 	14 October 1890|Oct\s*\.? 14\s*\,? 1890
1219	factoid	What does the technical term ISDN mean? 	(Integr)?ated Services? D(igital|ata) Ne(twork)?.*|Integrated Service Digital Network
1220	factoid	Why is the sun yellow? 	temperature
1221	factoid	What is the conversion rate between dollars and pounds? 	Dollars 1\.53|\$ 1\.6935|\$ 1\.6980|\$1\.5644
1222	factoid	When was Abraham Lincoln born? 	1809|Feb(ruary|\.?) 12
1223	factoid	What is the Milky Way? 	Galax(y|ies)|barred spiral|galactic
1224	factoid	What is mold? 	Aspergillus|fungus|mildew|slime|sooty
1225	factoid	What year was Mozart born? 	1756
1228	factoid	What is the melting point of gold? 	1\,?\s*900.*degree
1229	factoid	What is the street address of the White House? 	Pennsylvania Avenue|Sixteenth and Pennsylvania
1230	factoid	What is semolina? 	Pastina|couscous|flour|pasta|wheat
1231	factoid	What fruit is Melba sauce made from? 	peach|raspberr(y|ies)
1232	factoid	What is Ursa Major? 	Great Bear.*|c?onstellations?
1233	factoid	What is the percentage of water content in the human body? 	80
1234	factoid	How much does water weigh? 	64 pounds per cubic foot|8.3 pounds per gallon
1235	factoid	What was President Lyndon Johnson's reform program called? 	Great Society|war.*poverty
1236	factoid	What is the murder rate in Windsor, Ontario? 	1.5 per 100,000 people
1237	factoid	Who is the only president to serve 2 non-consecutive terms? 	Cleveland
1238	factoid	What is the population of Australia?  	15.4 million|16.5 million|17 million|17.5 million|1[78](\.4)?m|_?16_? million
1239	factoid	Who painted the ceiling of the Sistine Chapel? 	(Mic)?ha?ela(ngelo)?.*
1240	factoid	Name a stimulant. 	Clenbuterol|Corydrane|Dexedrine|Epogen|Leukine|Minoxidil|Neupogen|Ritalin|Temazepam.*|_?Rogaine_?|amphetamines?|caff(eine)?|cocaine|ephedrine|erythropoietin|khat|methamphetamine|methylphenidate|nicotine|norephedrine|phencyclidine|phenylpropanol[ao]mine|pseudoephedrine|sugar
1241	factoid	What is the effect of volcanoes on the climate? 	cool(er|ed)?|little weather.*effect
1242	factoid	What year did the Andy Griffith show begin? 	1960
1243	factoid	What is acid rain? 	conversion of oxides|form of pollution|nitric acid|nitrogen oxide|sulfur dioxide|sulfuric acid|tree-killing pollution
1244	factoid	What is the date of Mexico's independence? 	1810|1821
1245	factoid	What is the location of Lake Champlain? 	Burlington|Canada|New York|Plattsburgh|_?Vermont_?
1246	factoid	What is the Illinois state flower? 	violets?
1247	factoid	What is Maryland's state bird? 	Oriole
1248	factoid	What is quicksilver? 	cinnabar|reduction agent
1249	factoid	Who wrote "The Devine Comedy"? 	Dante
1250	factoid	What is the speed of light? 	186,000|186,200|186\,?451 miles|29.9292458 km per second|299,792 km/sec|300,000 km per second|6 trillion miles per year|670 million mph
1252	factoid	Why in tennis are zero points called love? 	goose( eggs?)?|l'oeuf
1253	factoid	What kind of dog was Toto in the Wizard of Oz? 	(cairn )?terriers?
1254	factoid	What is a thyroid? 	butterfly\s*\-?\s*shaped gland|gland|gland.*neck|makes a hormone|secretes hormones
1255	factoid	What does ciao mean? 	Farewell
1256	factoid	What is the only artery that carries blue blood from the heart to the lungs? 	pulmonary
1257	factoid	How often does Old Faithful erupt at Yellowstone National Park? 	21.*to 23 times a day|every 30 to 100 minutes|every 75 minutes
1258	factoid	What is acetic acid? 	vinyl acet(ate)?
1260	factoid	What color does litmus paper turn when it comes into contact with a strong acid? 	red
1261	factoid	What are the colors of the German flag? 	black.*red.*gold|red.*gold.*black
1262	factoid	What is the Moulin Rouge? 	cabaret|nightclub
1263	factoid	What soviet seaport is on the Black Sea? 	Sevastapol|Sevastopol
1264	factoid	What is the atomic weight of silver? 	110
1265	factoid	What currency do they use in Brazil? 	cruzado|cruzeiros?|real
1266	factoid	What are pathogens? 	agent of disease|agents of disease|bacteria|dangerous bacteria|disease affecting|disease-causing|microorganisms|parasites or viruses|viruses
1267	factoid	What is mad cow disease? 	BSE|bovine spongiform|bovine spongiform encep(halopathy)?|encephalopathy|nervous disorder|spongiform enceph(alitis)?
1268	factoid	Name a food high in zinc.  	Meats?|bananas?|whole grain
1270	factoid	Where do apple snails live? 	wetlands
1271	factoid	What are ethics? 	Philosophy|moral.*principles|morality|principles of right and wrong
1272	factoid	What does CPR stand for? 	cardio\-?\s*pulmonary resuscita(tion)?
1273	factoid	What is an annuity? 	paid to you at regular intervals|pay fixed monthly benefits|pension|regular income|retirement|tax-deferred savings plans
1274	factoid	Who killed John F. Kennedy? 	Oswald
1275	factoid	Who was the first vice president of the U.S.? 	John Adams
1276	factoid	What birthstone is turquoise? 	Dec(ember)?
1277	factoid	Who was the first US President to ride in an automobile to his inauguration? 	Harding
1278	factoid	How old was the youngest president of the United States? 	43
1279	factoid	When was Ulysses S. Grant born? 	1822
1280	factoid	What is Muscular Dystrophy? 	degenerative muscle disease|genetic diseases?|genetic disorder|genetic muscle-destroying disease|hereditary disorder|hereditary muscle diseases?|muscle wasting diseases|progressive weakness|wasting away of muscles
1281	factoid	Who lived in the Neuschwanstein castle? 	King Ludwig|_?Ludwig II_?
1282	factoid	What is propylene glycol? 	antifreeze|automotive coolants|cosmetics|fiberglass|personal-care products|pharmaceutical|used in the food and pharmaceutical industry
1283	factoid	What is a panic disorder? 	anxiety|attack of panic|chest pain|disease|emotional illness|incapacitating fear|intense fear|mental illness|serious.*disabling disease
1284	factoid	Who invented the instant Polaroid camera? 	Land
1285	factoid	What is a carcinogen? 	cancer-causing|cancer\s*-\s*inducing|cause.*cancer|chemicals known to cause cancer|substance that encourages the growth of cancer
1286	factoid	What is a baby lion called? 	cubs?
1287	factoid	What is the world's population? 	4\.9 billion|5.[467]\s*bn|_?5\.?[1234]?_? billion?|five billion
1288	factoid	What is nepotism? 	appoint.*relatives?|hiring relatives?|office favoritism|undue favoritism
1290	factoid	What is myopia? 	nearsighted(ness?)?|short sight
1291	factoid	What is the sales tax rate in New York? 	4\s*%|8%|8.*per.*cent|8.25 per cent
1292	factoid	Developing nations comprise what percentage of the world's population? 	75%|85 per cent|Three - fourths|four - fifths
1293	factoid	What is the fourth highest mountain in the world? 	Lhotse
1294	factoid	What is Shakespeare's nickname? 	bard
1295	factoid	What is the heaviest naturally occurring element? 	uran(ium)?
1296	factoid	When is Father's Day? 	third _?Sunday_? in June
1297	factoid	What does the acronym NASA stand for? 	National Aeronautics?.*Space Admini?stration
1298	factoid	How long is the Columbia River in miles? 	1,214|1\s*\,?\s*243|_?1,200_?
1299	factoid	What city's newspaper is called "The Star"? 	Johannesbu(rg)?|Kuala Lumpur
1300	factoid	What is carbon dioxide? 	gas
1301	factoid	Where is the Mason/Dixon line? 	Maryland and Pennsylvania?
1302	factoid	When was the Boston tea party? 	1773
1303	factoid	What is metabolism? 	efficiency of the body in burning fuel|process of breaking down food|rate at which energy is used|rate of burning calory
1304	factoid	Which U.S.A. president appeared on "Laugh-In"? 	Nixon
1305	factoid	What are cigarettes made of? 	glue and cotton|tobacco
1306	factoid	What is the capital of Zimbabwe? 	_?Harare_?
1307	factoid	What does NASA stand for? 	National Aeronautics.*Space Admini?stration
1308	factoid	What is the state flower of Michigan? 	apple
1309	factoid	What are semiconductors? 	Computer chips|building blocks of many electronic devices|electronic chips at the heart of computers|good conductors of electricity|integrated circuits|key parts of computers
1310	factoid	What is nuclear power? 	energy source|power generation by atomic energy
1311	factoid	What is a tsunami? 	dangerous wave|giant wave|huge waves|large waves?|ocean waves?|sea waves?|seismic waves?|tidal wave?s?|triggered by undersea earthquakes|wall of water|waves
1312	factoid	Who is the congressman from state of Texas on the armed forces committee? 	Leath
1313	factoid	Who was president in 1913? 	Wilson
1314	factoid	When was the first kidney transplant? 	1947
1315	factoid	What are Canada's two territories? 	Northwest.*Yukon|Yukon.*Northwest
1316	factoid	What was the name of the plane Lindbergh flew solo across the Atlantic? 	Spirit of St. Louis
1317	factoid	What is genocide? 	destruction|elimination|elimination of a racial group|ethnic cleansing|extermination|killi(ng)?|systematic killing
1318	factoid	What continent is Argentina on? 	South America
1319	factoid	What monastery was raided by Vikings in the late eighth century? 	Lindisfarne
1320	factoid	What is an earthquake? 	ground motion
1321	factoid	Where is the tallest roller coaster located? 	Cedar Point|Ohio|Sandusky
1322	factoid	What are enzymes? 	a protein that initiates or speeds up|catalysts|chemically active proteins|proteins that act as catalysts|speed.*chemical reactions?
1323	factoid	Who discovered oxygen? 	Priestle?y
1324	factoid	What is bangers and mash? 	potatoes|sausages|sausages and mashed potatoes|sausages.*potatoes
1325	factoid	What is the name given to the Tiger at Louisiana State University? 	Mike IV
1326	factoid	Where are the British crown jewels kept? 	Tower|Tower.*London|_?(Tow)?er_? of London
1327	factoid	Who was the first person to reach the North Pole? 	Henson|_?Peary_?
1328	factoid	What is an ulcer? 	open sore|sore
1329	factoid	What is vertigo? 	Dizziness|disorientation|loss.*balance|sensation motion|skewed balance|tinnitus
1330	factoid	What is the spirometer test? 	Lung Function|air from the lungs|air rate|breathing|capacity of the lungs|lungs|peak flow|vital capacity
1331	factoid	When is the official first day of summer? 	June 21|longest day|summer solstice
1332	factoid	What does the abbreviation SOS mean? 	distress signal
1334	factoid	Who invented Trivial Pursuit? 	Abbot_?|Haney
1335	factoid	What gasses are in the troposphere? 	(car)?bon dioxide|carbo|methane
1337	factoid	What is the scientific name for elephant? 	Loxodonta africana
1340	factoid	What is the rainiest place on Earth? 	Hawaii|Mount Waialeale
1341	factoid	Who was the first African American to win the Nobel Prize in literature? 	Morrison
1342	factoid	When is St. Patrick's Day? 	17 Mar(ch)?|_?March 17_?
1343	factoid	What was FDR's dog's name? 	Fala?
1345	factoid	What is the most popular sport in Japan? 	baseball
1346	factoid	What is the active ingredient in baking soda? 	bicarbon(ate)?|bicarbonate of soda|sodium bicarbonate
1347	factoid	When was Thomas Jefferson born? 	1743
1348	factoid	How cold should a refrigerator be? 	35|35 to 40 degre(es)?|between 32 and 40 degrees
1349	factoid	When was the telephone invented? 	1876
1352	factoid	What is schizophrenia? 	illness|loss of touch with reality|mental|mental disorders?|mental illness|psychos[ie]s|psychotic disorder|psychotic disorders?|schizoid personal(ity)?|split personality
1353	factoid	What is angiotensin? 	agents for tightening|blood pressure|causes blood vessels to tighten|compound|constricting blood|constrictor|forcing the heart to pump|hormone|most potent agents|pressure\s?\-?raising substance|rais(es|ing) blood pr(essure)?
1354	factoid	What did Jesse Jackson organize? 	PUSH|Rainbow Coalition|United to Save Humanity
1355	factoid	What is New York's state bird? 	bluebird
1356	factoid	What is the National Park in Utah? 	Arches|Bryce( Canyon)?|Canyonlands|Capit[oa]l Reef|Echo Canyon|Fishlake|Zion
1357	factoid	What is Susan B. Anthony's birthday? 	15 February|1820|Feb. 15
1358	factoid	In which state would you find the Catskill Mountains? 	N\.Y\.?|New\s*York|York
1359	factoid	What do you call a word that is spelled the same backwards and forwards? 	palindrom(es?|ic)
1360	factoid	What are pediatricians? 	treat.*children|with children
1361	factoid	What chain store is headquartered in Bentonville, Arkansas? 	W?al\s?\-?\s?Mart|Wal\-M|Wal\s*\-
1362	factoid	What are solar cells? 	collect and funnel energy|conversion|conversion from light energy|convert.*light|generat.*electricity|photovoltaic|produce.*electricity|provide electricity|to electric energy
1364	factoid	What are capers? 	buds?|on the stalk|plants|shrub|thick stems
1365	factoid	What is an antigen? 	alien organisms|cell|chemical|foreign (proteins|substances)|foreign bod(y|ies)|molecules|proteins?|toxic particles
1366	factoid	What currency does Luxembourg use? 	francs?
1367	factoid	What is the population of Venezuela? 	(18|19|20) million|19.2m|20.7m|20\s*m|_?18.43.*million_?
1368	factoid	What type of polymer is used for bulletproof vests? 	Kevlar|Luaramid
1369	factoid	What currency does Argentina use? 	australs?|peso
1370	factoid	What is a thermometer? 	check the temperature|measure.*temperature|measuring.*temperatures?|monitor.*temperature|register.*temperatures?|tells you the real temperature|temperature measurements
1371	factoid	What Canadian city has the largest population? 	Montreal|Toronto
1372	factoid	What color are crickets? 	black|brown
1373	factoid	Which country gave New York the Statue of Liberty? 	France
1374	factoid	What was the name of the first U.S. satellite sent into space? 	Explorer
1375	factoid	What precious stone is a form of pure carbon? 	diamonds?
1377	factoid	What is rheumatoid arthritis? 	(immune\s*\-\s*)?inflammatory diseases?|autoimmune diseases?|chronic disease|crippling disorder|debilitating diseases?|disease.*inflammation|inflammation
1379	factoid	What is cerebral palsy? 	affects.*muscles|brain damage|crippled|crippling disease|damage to the brain|defective motor ability|disorder of central nervous system|disorder of the central nervous system|incurable disease|lacks motor control|loss of muscle|nervous disorder|nervous system disorder|neurological disorder|paralysis
1380	factoid	What city is also known as "The Gateway to the West"? 	St\s*\.? Louis
1381	factoid	How far away is the moon? 	221\,?\s*000 miles|238,855 miles|2[345]0\,?000.*miles
1382	factoid	What is the source of natural gas? 	Methane?
1383	factoid	In what spacecraft did U.S. astronaut Alan Shepard make his historic 1961 flight? 	Freedom 7|Mercury
1384	factoid	What is pectin?  	apple derivative|carbohydrate|gelling agent|product extracted from citrus fruit peel|sticky substance.*make jelly
1385	factoid	What is bio-diversity? 	ecosystem diversity|multiplicity of species|variety of the world\s*'s wildlife
1387	factoid	What year did the Titanic start on its journey? 	1912
1389	factoid	Who was the 22nd President of the US? 	Cleveland
1390	factoid	What is the money they use in Zambia? 	Kwachas?
1391	factoid	How many feet in a mile? 	5\,?280.*
1393	factoid	What is e-coli? 	Escherichia|Escherichia coli|bacteri(al?|um)
1394	factoid	In what country did the game of croquet originate? 	French
1395	factoid	Who was Tom Cruise married to last? 	Katie Holmes
1396	factoid	What is the name of the volcano that destroyed the ancient city of Pompeii? 	Vesuvius
1397	factoid	What was the largest crowd to ever come see Michael Jordan? 	62,046
1398	factoid	What year was Alaska purchased? 	1867
1399	factoid	What mythical Scottish town appears for one day every 100 years? 	Brigadoon
1400	factoid	When was the telegraph invented? 	1844|1860
1401	factoid	What is the democratic party symbol? 	donkey
1402	factoid	What year did Wilt Chamberlain score 100 points? 	1962
1403	factoid	When was the internal combustion engine invented? 	1867
1404	factoid	How many chromosomes does a human zygote have? 	23 pairs|46
1405	factoid	How many ounces are in a gallon? 	128
1406	factoid	When did the story of Romeo and Juliet take place? 	13th century
1407	factoid	When did the shootings at Columbine happen? 	April 20\s?, 1999
1408	factoid	Which political party is Lionel Jospin a member of? 	Socialist
1409	factoid	Which vintage rock and roll singer was known as "The Killer"? 	Jerry Lee Lewis
1410	factoid	What lays blue eggs? 	Araucana
1411	factoid	What Spanish explorer discovered the Mississippi River? 	Hernando de Soto
1412	factoid	Who is the governor of Colorado? 	(Roy_)?Romer|Owens
1413	factoid	What river is called "China's Sorrow"? 	Yellow
1414	factoid	What was the length of the  Wright brothers' first flight? 	120\s?\-?\s?f(ee|oo)t
1415	factoid	Where does the vice president live when in office? 	U.S\s?. Naval Observatory
1416	factoid	When was Wendy's founded? 	1969
1417	factoid	Who was the first person to run the mile in less than four minutes? 	Roger Bannister
1418	factoid	When was the Rosenberg trial? 	1951
1419	factoid	What year did Alaska become a state? 	1958|1959
1421	factoid	When did Mike Tyson bite Holyfield's ear? 	1997
1423	factoid	What is a peninsula in the Philippines? 	Bataan|Bicol|Zamboanga
1424	factoid	Who won the Oscar for best actor in 1970? 	George C. Scott
1425	factoid	What is the population of Maryland? 	5.1 million
1426	factoid	Who is the governor of Tennessee? 	Sundquist
1427	factoid	What was the first spaceship on the moon? 	Eagle
1428	factoid	Who won the Nobel Peace Prize in 1992? 	Menchu
1429	factoid	What was Andrew Jackson's wife's name? 	Rachel
1431	factoid	Who starred in "The Poseidon Adventure"? 	Gene Hackman|Roderick Andrew Anthony Jude McDowall
1432	factoid	Where is Devil's Tower? 	Wyoming
1433	factoid	What is the height of the tallest redwood? 	367 1/2|367.5|370\s?-\s?foot(-tall)?
1434	factoid	What site did Lindbergh begin his flight from in 1927? 	Long Island|New\s?York|Roosevelt Field
1435	factoid	What nation is home to the Kaaba? 	Saudi Arabia
1436	factoid	What was the name of Stonewall Jackson's horse? 	Little Sorrel
1438	factoid	What body of water does the Colorado River flow into? 	Gulf of Mexico
1439	factoid	How deep is Crater Lake? 	1\s?,\s?932 feet
1440	factoid	Who was the lead singer for the Commodores? 	Lionel Richie
1441	factoid	What is the coldest place on earth? 	Antarctica?|South Pole|Vostok Station
1442	factoid	What is the chemical formula for sulphur dioxide? 	SO2
1443	factoid	When did Bob Marley die? 	1981
1444	factoid	What female leader succeeded Ferdinand Marcos as president of the Philippines? 	Corazon Aquino
1446	factoid	How did Mahatma Gandhi die? 	shot dead
1447	factoid	What is the capital of Syria? 	Damascus
1449	factoid	What college did Magic Johnson attend? 	Michigan State
1450	factoid	Which U.S. state is the leading corn producer? 	Iowa
1451	factoid	Where was the first McDonalds built? 	California|San Bernardino( , Calif.)?
1452	factoid	What is the name given to a collection of poetry?1 	compendium
1453	factoid	Where was the first J.C. Penney store opened? 	Kemmerer\s?, Wyo\.?
1454	factoid	How much money does the U.S. supreme court make? 	\$ 175,400
1455	factoid	The Hindenburg disaster took place in 1937 in which New Jersey town? 	Lakehurst
1456	factoid	What is the Keystone State? 	Pennsylvania
1457	factoid	Who succeeded Ferdinand Marcos? 	Corazon Aquino
1458	factoid	What was the name of the high school in "Grease"? 	Rydell
1459	factoid	What is one national park in Indiana? 	Indiana Dunes National Lakeshore
1460	factoid	What was the name of the dog in the Thin Man movies? 	Asta
1462	factoid	Where is the oldest synagogue in the United States? 	Newport
1463	factoid	What is the North Korean national anthem? 	Patriotic Song
1464	factoid	Who is the detective on "Diagnosis Murder"? 	Steve Sloan
1465	factoid	What company makes Bentley cars? 	Rolls\s?-?\s?Royce|VW|Volkswagen
1466	factoid	How tall is Allen Iverson? 	6\s?-?\s?f(ee|oo)t|six\s?-?feet
1467	factoid	What year did South Dakota become a state? 	1889
1469	factoid	When did Alexandra Graham Bell invent the telephone? 	1876
1470	factoid	When did president Herbert Hoover die? 	1964
1471	factoid	How fast does a cheetah run? 	105 kilomet(er|re)s? per hour|60 m.p.h
1472	factoid	How do you say "house" in Spanish? 	casa
1473	factoid	When was Lyndon B. Johnson born? 	1908
1474	factoid	What is the lowest point on earth? 	Dead Sea
1475	factoid	Who was the first person to reach the south pole? 	Amundsen
1476	factoid	Who was the Roman god of the sea? 	Neptune
1477	factoid	What are wavelengths measured in? 	angstrom|nanometers
1478	factoid	What is the name of the heroine in "Gone with the Wind"? 	Scarlett
1479	factoid	Who composed "The Messiah"? 	Handel
1480	factoid	What is the principle port in Ecuador? 	Guayaquil
1481	factoid	What is the capital city of Algeria? 	Algiers
1482	factoid	What county is Wilmington, Delaware in? 	New Castle
1483	factoid	Where is the highest point on earth? 	Everest
1484	factoid	What college did Allen Iverson attend? 	Georgetown
1487	factoid	How much are tickets to Disney World? 	30.5\s?0|\$\s?46(.64)?
1488	factoid	What is the name of the professional baseball team in Myrtle Beach, South Carolina? 	Pelicans
1489	factoid	What continent is India on? 	Asia
1490	factoid	What is the Boston Strangler's name? 	Albert DeSalvo
1491	factoid	What was the name of Sherlock Holmes' brother? 	Mycroft
1492	factoid	How old was Nolan Ryan when he retired? 	4(4|6)
1493	factoid	When was Davy Crockett born? 	1786
1494	factoid	Who wrote "East is east, west is west and never the twain shall meet"? 	Kipling
1496	factoid	What country is Berlin in? 	Germany
1497	factoid	What was the original name before "The Star Spangled Banner"? 	Defense of Fort M'Henry
1498	factoid	What school did Emmitt Smith go to? 	Escambia High School
1499	factoid	Which African country's major export is coffee? 	Ethiopia|Tanzania|Uganda
1500	factoid	Where is Georgetown University? 	Washington,?
1501	factoid	How much of U.S. power is from nuclear energy? 	20 percent
1502	factoid	What year was President Kennedy killed? 	1963
1503	factoid	What is the world's second largest island? 	New Guinea
1504	factoid	Where is the Salton Sea? 	Calif(\s?\.|ornia)
1505	factoid	What is the currency used in China? 	RMB|Ren?minbi|Yuan
1506	factoid	What's the name of King Arthur's sword? 	Excalibur
1507	factoid	What is the national anthem in England? 	God Save the Queen
1508	factoid	What was Dale Evans' horse's name? 	Buttermilk
1509	factoid	What is Frank Sinatra's nickname? 	Chairman of the Board|Ol\s?' Blue Eyes
1510	factoid	Where is Anne Frank's diary? 	Amsterdam
1512	factoid	What is the age of our solar system? 	4.(5|6) billion years
1513	factoid	What is the current population in Bombay, India? 	15 million
1514	factoid	What is Canada's most populous city? 	Toronto
1515	factoid	What was Dr. Seuss' real name? 	Theodore? (Seuss )?Geisel
1516	factoid	What does CPR stand for? 	Contraceptive Prevalence Rate|cardio\s?-?\s?pulm(o|i)nary resuscitation
1517	factoid	What is the state bird of Alaska? 	willow ptarmigans?
1518	factoid	What year did Marco Polo travel to Asia? 	1292
1519	factoid	Where was Hans Christian Anderson born? 	Denmark|Odense
1520	factoid	What is the capital of Kentucky? 	Frankfort
1521	factoid	What year did Ellis Island open its doors to immigrants? 	1892
1522	factoid	What are the headpieces called that the Saudi Arabians wear? 	kaffiyeh
1523	factoid	What percent of the U.S. is African American? 	1(2|3)(.\s?(7|8))? percent
1524	factoid	What is the name of the ballpark that the Milwaukee Brewers play at? 	County Stadium|Miller Park
1525	factoid	What university did Thomas Jefferson found? 	Virginia
1526	factoid	What is the city of brotherly love? 	Philadelphia
1527	factoid	When did the 6-day war begin? 	June 5\s?, 1967
1528	factoid	Where did Kublai Khan live? 	Beijing|China
1529	factoid	What is the oldest college bowl game? 	Rose Bowl Game
1530	factoid	What is the capital city of New Zealand? 	Wellington
1531	factoid	What does NASDAQ stand for? 	National Association of Securities Dealers Automated Quotations?
1532	factoid	What is the literacy rate in Cuba? 	96 percent
1533	factoid	Who directed the film "Fail Safe"? 	Sidney Lumet
1534	factoid	The sun is mostly made up of what two gasses? 	hydrogen .*helium
1535	factoid	Who painted "Sunflowers"? 	van Gogh
1536	factoid	What city is Lake Washington by? 	Seattle
1537	factoid	How many electoral college votes in Tennessee? 	11
1538	factoid	Who is the evil H.R. Director in "Dilbert"? 	Catbert
1539	factoid	What is Ronald Reagan's favorite candy? 	Jelly Belly|jelly\s?beans?
1540	factoid	What is the deepest lake in America? 	Crater
1541	factoid	What president is on a quarter? 	Washington
1542	factoid	Where is Hill Air Force Base? 	Ogden,?|Utah|about 120 kilometers west of Salt_Lake_City
1544	factoid	What is the most populated country in the world? 	China
1545	factoid	What is a female rabbit called? 	doe
1546	factoid	What year was the movie "Ole Yeller" made? 	1957
1547	factoid	What is the atomic number of uranium? 	92
1549	factoid	What year was the PC invented? 	1981
1550	factoid	What is the southwestern-most tip of England? 	Cornwall
1551	factoid	What does DNA stand for? 	deoxyribonucleic acid
1552	factoid	What did Charles Babbage invent? 	Analytic(al)? Engine|computer
1553	factoid	Who makes Magic Chef refrigerators? 	Maytag
1554	factoid	What is the scientific name for tobacco? 	Nicotiana alata
1555	factoid	When was the Tet offensive in Vietnam? 	1968
1556	factoid	What cemetery is Thurgood Marshall buried in? 	Arlington
1557	factoid	What was the first satellite in space? 	Sputnik
1559	factoid	Where did Dr. King give his speech in Washington? 	Lincoln Memorial
1560	factoid	What was Denzel Washington's first television series? 	St. Elsewhere
1561	factoid	When was the first patent filed on the ice cream cone? 	1903
1562	factoid	Where did the U.S. Civil War begin? 	Fort Sumter
1563	factoid	Who started the Protestant reformation? 	Luther
1564	factoid	When did Led Zeppelin appear on BBC? 	1969
