1854	factoid	What was William Shakespeare's occupation before he began to write plays? 
1855	factoid	How fast is the world spinning? 
1856	factoid	What city is known as the rubber capital of the world? 
1857	factoid	What is the length of Churchill Downs racetrack? 
1858	factoid	Tell me where the DuPont company is located. 
1859	factoid	What branch of the military has its academy in Annapolis? 
1860	factoid	What Broadway musical is the song "The Story is Me" from? 
1861	factoid	Where was Bill Gates born? 
1862	factoid	What is the GDP of China? 
1863	factoid	Who said "I have not begun to fight!"? 
1864	factoid	What was the name of the first child of English parents to be born in America? 
1865	factoid	What is the major crop grown in Arizona? 
1866	factoid	What part of the eye continues to grow throughout a person's life? 
1867	factoid	Which Italian city is home to the Cathedral of Santa Maria del Fiore or the Duomo? 
1868	factoid	What capital is on the Susquehanna River? 
1869	factoid	In the Bible, who was Jacob's mother? 
1870	factoid	What country is Pretoria in? 
1871	factoid	How much gravity exists on Mars? 
1872	factoid	How did Eva Peron die? 
1873	factoid	What is the motto for California? 
1874	factoid	When was the battle of Shiloh? 
1875	factoid	What county is St. Paul, Minnesota in? 
1876	factoid	How far from the earth is the sun? 
1877	factoid	What is the name of a newborn swan? 
1878	factoid	What year was the phonograph invented? 
1879	factoid	By what nickname was musician Ernesto Antonio Puente, Jr. best known? 
1880	factoid	When was King Louis XIV born? 
1881	factoid	What is the scientific name for the zinnia plant? 
1882	factoid	What nationality is Sean Connery? 
1883	factoid	How much of the ozone layer is depleted? 
1884	factoid	Where is the Sea of Tranquility? 
1885	factoid	What language do they speak in New Caledonia? 
1886	factoid	What are Brazil's national colors? 
1887	factoid	What was the name of the first enclosed baseball park? 
1888	factoid	What year was the light bulb invented? 
1889	factoid	How old is the Red Pyramid? 
1890	factoid	Who is the author of the poem "The Midnight Ride of Paul Revere?" 
1891	factoid	Who was the first black heavyweight champion? 
1892	factoid	Where does cinnamon come from? 
1893	factoid	What American general is buried in Salzburg? 
